{
  "source_id": "fastapi-di-read-items",
  "repository_owner": "fastapi",
  "repository_name": "fastapi",
  "repository_url": "https://github.com/fastapi/fastapi",
  "commit_sha": "50113da16fec53b66b80d75e80a89296de4fa5a5",
  "branch_or_tag": "50113da16fec53b66b80d75e80a89296de4fa5a5",
  "file_path": "docs_src/dependencies/tutorial001_an_py310.py",
  "symbol": "read_items",
  "symbol_type": "async_function",
  "line_start": 12,
  "line_end": 14,
  "code_excerpt": "@app.get(\"/items/\")\nasync def read_items(commons: Annotated[dict, Depends(common_parameters)]):\n    return commons",
  "excerpt_hash": "dcfd9d2f950c7e4686f6743c190cdc6470e18a115d818148d16d68380073822d",
  "license_name": "MIT",
  "license_url": "https://github.com/fastapi/fastapi/blob/50113da16fec53b66b80d75e80a89296de4fa5a5/LICENSE",
  "retrieved_at": "2026-09-07T13:47:54.906868+00:00",
  "verification_status": "GITHUB_SOURCE_VERIFIED",
  "source_status": "GITHUB_SOURCE_VERIFIED",
  "relevance_reason": "FastAPI 官方示例在 read_items 的参数中用 Depends(common_parameters) 声明依赖，由框架提供解析后的参数。",
  "verification_method": "GitHub API resolved repository + immutable commit + file blob; Python AST resolved symbol and exact line interval; LICENSE checked at same commit. Frozen fixture only.",
  "mode": "FIXTURE",
  "visibility": "public"
}
